name,Description,Location,tags
OmniAI,Build AI applications on your infrastructure,,"W24,B2B,Infrastructure"
Keywords AI,LLM monitoring platform for AI startups,"San Francisco, CA, USA","W24,B2B,Engineering, Product and Design"
PromptArmor,Security and Compliance for LLM Applications,,"W24,B2B,Security"
Zaymo,Interactive email builder for ecommerce brands,"Orem, UT, USA","W24,B2B,Marketing"
Glimmer,AI search for massive PDFs,"San Francisco, CA, USA","W24,B2B"
Celest,The Vercel of Flutter,"San Francisco, CA, USA","W24,B2B,Infrastructure"
Meticulate,The AI engine for world-class business research,,"W24,B2B,Finance and Accounting"
CloudCruise,An API to trigger workflows in the browser,"San Francisco, CA, USA","W24,B2B"
Attunement,Automation workflow for psychiatric assessments.,"San Francisco, CA, USA","W24,Healthcare"
Lucite,Automating deliverables for finance professionals. ,"New York, NY, USA","W24,B2B"
Selera Medical,"One-time, device-based treatment for heart failure","Mountain View, CA, USA","W24,Healthcare,Medical Devices"
OneGrep,AI Agent for DevOps Workflow Automation,"New York, NY, USA","W24,B2B,Engineering, Product and Design"
Parasale,AI Recruiter: Find and Engage Candidates on Autopilot,"San Francisco, CA, USA","W24,B2B,Recruiting and Talent"
Tusk,AI agent that fixes customers' bugs instantly,"San Francisco, CA, USA","W24,B2B,Engineering, Product and Design"
PartnerHQ,A marketplace for B2B businesses to buy warm intros. ,,"W24,B2B,Sales"
atopile,We make tools to design electronics circuit boards with code,"San Francisco, CA, USA","W24,B2B,Engineering, Product and Design"
Airfront,AI automation platform for your email inbox,"San Francisco, CA, USA","W24,B2B,Productivity"
SynsoryBio,"""If-then"" conditional logic for protein drugs","Cambridge, MA, USA","W24,Healthcare,Therapeutics"
Yoneda Labs,Foundation Model for Chemical Manufacturing,,"W24,B2B"
TokenOwl,AI portfolio tools for the next generation of finance,"New York, NY, USA","W24,Fintech"
Hona,AI to help physicians intake and treat patients,"San Francisco, CA, USA","W24,Healthcare,Healthcare IT"
Topo,AI sales agent custom trained for each company to reach the best leads,"Paris, Île-de-France, France","W24,B2B,Sales"
Trellis,AI-powered workflows for unstructured data,,"W24,B2B"
Ecliptor,AI and Embeddings. ,"San Francisco, CA, USA","W24,B2B,Sales"
Greenboard,'Rippling' for Financial Compliance and Operations ,,"W24,Fintech"
Eggnog,Youtube for AI-generated content,"New York, NY, USA","W24,Consumer"
Simplex,Synthetic vision datasets for foundation model training,"San Francisco, CA, USA","S24,B2B,Engineering, Product and Design"
Artisan,"AI Employees Called Artisans, Starting With An AI BDR","San Francisco, CA, USA","W24,B2B"
Octolane AI,Building AI-first Salesforce,"San Francisco, CA, USA","W24,B2B,Sales"
SuretyNow,The Modern Surety Bond Platform,"Austin, TX, USA","W24,Fintech,Insurance"
Roe AI,"Data warehouse to query unstructured data like docs, webs, imgs & more","San Mateo, CA, USA","W24,B2B,Infrastructure"
FurtherAI,AI workforce for insurance industry,,"W24,B2B"
Arini,AI receptionist for dentists,"San Francisco, CA, USA","W24,Healthcare,Healthcare IT"
Paradigm,A reimagined workspace with AI at its core,"San Francisco, CA, USA","W24,B2B"
PointOne,Automated time tracking and billing for law firms.,,"W24,B2B,Legal"
Patchwork,Your team’s AI powered communication tool,"San Francisco, CA, USA","W24,B2B,Productivity"
Starlight Charging,Ultra-low-cost EV charging for condos and apartments,"Austin, TX, USA","W24,Industrials,Energy"
Assembly,Contextual Code Search for engineering teams ,"San Francisco, CA, USA","W24,B2B,Productivity"
MathDash,Turning Math into a Sport,,"W24,Education"
Leaping,Automate bug resolution,"San Francisco, CA, USA","W24,B2B,Engineering, Product and Design"
Basalt Tech,"Autonomy in space, for every mission","San Francisco, CA, USA","W24,Industrials,Aviation and Space"
Carousel Technologies,Professional AI toolkit for PowerPoint,"New York, NY, USA","W24,B2B,Finance and Accounting"
Agentic Labs,AI system design tools for dev teams,"New York, NY, USA","W24,B2B,Engineering, Product and Design"
Fractal Labs,AI game engine powering self-generating open world RPGs,,"W24,Consumer,Gaming"
Pivot Robotics,AI for Robot Arms in Factories,"San Francisco, CA, USA","W24,Industrials,Manufacturing and Robotics"
Aidy,We help government affairs professionals track and analyze legislation,"San Francisco, CA, USA","W24,B2B,Operations"
DGI Apparel,Expedia for ordering blank apparel,"New York, NY, USA","W24,B2B,Supply Chain and Logistics"
Buster,Infrastructure to connect LLMs and databases,"San Francisco, CA, USA","W24,B2B,Engineering, Product and Design"
Garage,Marketplace for used firefighting equipment.,,"W24,B2B"
Mango Health,We get physicians paid for sending patients to therapy.,"San Francisco, CA, USA","W24,Healthcare"
"Argon AI, Inc.",AI for Pharma Intelligence ,,"W24,Healthcare"
nCompass Technologies,Deploy hardware accelerated AI models with only one line of code,Remote,"W24,B2B,Engineering, Product and Design"
Pretzel AI,Open-source & AI-native replacement for Jupyter Notebooks,"Berlin, Berlin, Germany","W24,B2B,Analytics"
Apriora,Your AI recruiter for interviewing and identifying the best talent,"San Francisco, CA, USA","W24,B2B,Recruiting and Talent"
malibou,the first all-in-one payroll and HR software for French SMBs,"Paris, IDF, France","W24,B2B,Human Resources"
Quary,The first in-browser analytics engineering platform,"London, England, United Kingdom","W24,B2B,Analytics"
Hemingway,Modern Patient Management for Retail Healthcare,"San Francisco, CA, USA","W24,B2B"
Tile,AI-first notebook for building operational data apps,"New York, NY, USA","W24,B2B,Analytics"
Adagy Robotics,Rescuing robots,,"W24,Industrials,Manufacturing and Robotics"
Momentic,Automated testing with generative AI,"San Francisco, CA, USA","W24,B2B,Engineering, Product and Design"
Reducto,Unlocking data behind complex documents,,"W24,B2B,Engineering, Product and Design"
Vectorview,Building custom evaluation tasks for AI,,"W24,B2B,Engineering, Product and Design"
Maia,AI relationship app that keeps couples together,"San Francisco, CA, USA","W24,Healthcare,Consumer Health and Wellness"
Poka Labs,The modern operating system for chemical manufacturing.,"San Francisco, CA, USA","S24,B2B"
"Nuanced, Inc.","Nuanced detects AI fraud, deepfakes, and misinformation. ",Remote,"W24,B2B"
Precip,High precision AI weather models,Remote,"W24,B2B"
Tracecat,Open source Tines / Splunk SOAR alternative for security engineers.,"San Francisco, CA, USA","W24,B2B,Security"
Kabilah,Simplifying Patient Handoff for Nurses,"Stanford, CA, USA","W24,Healthcare"
Sonia,AI Therapy for Mental Health,"San Francisco, CA, USA","W24,Healthcare,Consumer Health and Wellness"
MAIHEM,AI agents that test AI products ,,"W24,B2B,Analytics"
ion design,Your front end team in a box - Prompt to code & Figma to code,"San Francisco, CA, USA","W24,B2B,Engineering, Product and Design"
Duckie,AI technical support engineer that handles tickets.,,"W24,B2B,Engineering, Product and Design"
Happenstance,People search powered by AI,Remote,"W24,Consumer"
Ubicloud,Open source alternative to AWS,,"W24,B2B,Infrastructure"
Greptile,AI expert on your codebase that you can query via an API,"San Francisco, CA, USA","W24,B2B,Engineering, Product and Design"
PurplePages,Purple is an AI agent for online local marketplace transactions.,"San Francisco, CA, USA","W24,Consumer,Home and Personal"
ego,AI-native 3D simulation engine ,,"W24,Consumer"
Leya,The AI workspace for lawyers,"Stockholm, Stockholm County, Sweden","W24,B2B,Legal"
Scritch,AI operating system for veterinary care,"San Francisco, CA, USA","W24,Healthcare"
RadMate AI,Copilot for radiologists,"San Francisco, CA, USA","W24,Healthcare"
OpenPipe,Turn expensive prompts into cheap fine-tuned models,"Seattle, WA, USA","S23,B2B,Engineering, Product and Design"
SSOReady,Open source developer tools for enterprise single sign-on,"San Francisco, CA, USA","W24,B2B"
Relari,Testing and Simulation Stack for GenAI Systems,,"W24,B2B,Infrastructure"
DryMerge,Automate work with plain English.,"San Francisco, CA, USA","W24,B2B"
Navier AI,Real-Time CFD Simulations,,"W24,Industrials,Aviation and Space"
Upsolve AI,"Customer-facing analytics as a service, powered by AI.",,"W24,B2B,Analytics"
SciPhi,Build and deploy  production-ready RAG,"San Francisco, CA, USA","W24,B2B,Engineering, Product and Design"
Gumloop,A no-code platform for automating workflows with AI,,"W24,B2B"
Driver AI,Understand millions of lines of code in minutes.,,"W24,B2B"
Lantern,Postgres vector database extension to build AI applications,"San Francisco, CA, USA","W24,B2B"
Danswer,Open Source AI Assistant and Enterprise Search,,"W24,B2B,Productivity"
Flex,Stripe for HSA/FSA payments,Remote,"S23,Fintech,Payments"
Martin,"Your AI butler, like Jarvis.",,"S23,Consumer"
Healthtech 1,Automating repetitive processes in healthcare,"London, England, United Kingdom","S23,Healthcare,Healthcare IT"
Feanix Biotechnologies,Farm Genetics Made Easy - Using DNA and Software,"Asheville, NC, USA","S23,Industrials,Agriculture"
Orbio Earth,Tracking methane emissions with satellites,Remote,"S23,B2B,Analytics"
CodeStory,"Aide is an AI-native , privacy-first IDE built on top of VSCode","London, England, United Kingdom","S23,B2B,Engineering, Product and Design"
CatX,The digital marketplace for insurance risk ,,"S23,Fintech,Insurance"
Coba,Dual Currency Accounts For LatAm,"Monterrey, N.L., Mexico","S23,Fintech"
Taylor AI,Unified Platform for Text Enrichment,"San Francisco, CA, USA","S23,B2B,Engineering, Product and Design"
Tempo Labs,AI design tool like figma which can edit any react codebase,"Toronto, ON, Canada","S23,B2B,Engineering, Product and Design"
Curatle,the Amazon search for all products on the internet,"Irvine, CA, USA","S23,Consumer"
Autotab,The digital robot that does your repetitive work,,"S23,B2B,Productivity"
Flair Health,Platform to reduce care gaps for patients with inflammatory disease,"San Francisco, CA, USA","S23,Healthcare,Healthcare IT"
Olio Labs,Combination therapeutics for the world's toughest diseases,Remote,"S23,Healthcare,Drug Discovery and Delivery"
truemetrics,Helping logistics companies to deliver to their customer’s doorstep.,"Berlin, Berlin, Germany","S23,B2B,Supply Chain and Logistics"
Glide,Let users pay for onchain transactions with any token on any chain,"New York, NY, USA","S23,B2B,Infrastructure"
Wattson Health,Software for pharmacies to manage RXs and automate manual workflows,,"S23,Healthcare,Healthcare IT"
Constructable,AI copilot for construction teams,"Santa Barbara, CA, USA","S23,Real Estate and Construction,Construction"
innkeeper,AI-native software stack for running a hotel,"San Francisco, CA, USA","S23,B2B"
Nowadays,AI co-pilot for corporate event planning,,"S23,B2B,Operations"
Structured,Simplify Data Consumption for Business Users,,"S23,B2B,Engineering, Product and Design"
Twine,AI text message receptionist for SMBs,"San Francisco, CA, USA","S23,B2B,Sales"
Srcbook,TypeScript notebooks,,"S23,B2B,Infrastructure"
Simbie Health,Filling gaps in transitions of care,,"S23,Healthcare"
Foundation,Shopify for Homebuilders,"Boulder, CO, USA","S23,Real Estate and Construction,Housing and Real Estate"
AiSDR,AI sales prospecting. Replace your SDR with AiSDR,"San Francisco, CA, USA","S23,B2B,Sales"
Giga ML,AI customer service agent for B2C  Companies,"San Francisco, CA, USA","S23,B2B,Engineering, Product and Design"
Saatvy,Root cause help for chronic conditions,"San Jose, CA, USA","S23,Healthcare,Consumer Health and Wellness"
Affinity,A compliance training platform built for regulated industries.,"New York, NY, USA","S23,B2B"
FlowiseAI,Open source Low-Code LLM development platform,Remote,"S23,B2B,Engineering, Product and Design"
Shadeform,The GPU Cloud Marketplace,,"S23,B2B,Engineering, Product and Design"
Ten,Helping developers understand code remarkably fast.,"Limerick, County Limerick, Ireland","S23,B2B,Productivity"
Cargo,Building the data stack for revenue teams,"San Francisco, CA, USA","S23,B2B,Sales"
CheqUPI,India's first UPI wallet for foreign nationals and NRIs,"Bengaluru, KA, India","S23,Fintech"
Roame,Google flights using credit card points and miles,"San Francisco, CA, USA","S23,Fintech,Consumer Finance"
dili,The Most Reliable LLM for Diligence on High-Stakes Deals,"New York, NY, USA","S23,B2B,Finance and Accounting"
Instaclass,Make a masterclass on literally anything,"San Francisco, CA, USA","S23,Consumer,Content"
Trayd,A construction payroll platform designed for same-day pay.,"New York, NY, USA","S23,B2B,Finance and Accounting"
Cair Health,Predictive analytics and automation for medical claims,,"S23,Healthcare,Healthcare IT"
ParadeDB,Postgres for Search and Analytics,"New York, NY, USA","S23,B2B"
Eden Care,Digital health insurance for employers in Africa,"Nairobi, Nairobi County, Kenya","S23,Fintech,Insurance"
Quill AI,AI Powered Equity Research Platform,"New York, NY, USA","S23,B2B,Finance and Accounting"
Strada,AI agent for workflow automation,"San Francisco, CA, USA","S23,B2B,Engineering, Product and Design"
AgentsForce,AI support agents to solve the tickets that reach humans,"Tel Aviv-Yafo, Tel Aviv District, Israel","S23,B2B"
Smobi,Zillow for SMB Sales,"New York, NY, USA","S23,Consumer"
Tiptap,Developer toolkit for building collaborative apps.,"Berlin, Berlin, Germany","S23,B2B,Engineering, Product and Design"
RecipeUI,The open source Postman alternative.,"New York, NY, USA","S23,B2B,Engineering, Product and Design"
Fiber AI,We automate SDR / BDR prospecting & outbound sales workflows using AI,"San Francisco, CA, USA","S23,B2B"
OpsBerry AI,Secure your identity sprawl with AI.,"Las Vegas, NV, USA","S23,B2B,Security"
Certainly Health,Marketplace to book doctors and avoid surprise bills,,"S23,Healthcare"
Cedalio,Accurate Sustainability Data with AI,"San Francisco, CA, USA","S23,B2B"
Happyrobot,AI agents to automate phone calls in the logistics industry,"San Francisco, CA, USA","S23,B2B,Supply Chain and Logistics"
Pure,Marketplace for Rare Coins & Precious Metals,"San Francisco, CA, USA","S23,Consumer"
Nanograb,AI-generated binders for targeted drug delivery,"San Francisco, CA, USA","S23,Healthcare,Drug Discovery and Delivery"
Elythea,ML to predict and prevent pregnancy complications ,"San Jose, CA, USA","S23,Healthcare"
Movley,Rippling for supply chain.,"New York, NY, USA","S23,B2B,Supply Chain and Logistics"
Santé,All-in-one POS for liquor stores,"New York, NY, USA","S23,B2B,Retail"
Langdock,The AI platform for team productivity,,"S23,B2B,Productivity"
Inventive AI,GenAI-First RFP & Sales Questionnaire Response Platform,"Mountain View, CA, USA","S23,B2B,Sales"
SyntheticFi,Cheapest way to get liquidity from your stock investments,"San Francisco, CA, USA","S23,Fintech,Asset Management"
Fragment,Supercharge your Backoffice Operations,"Paris, Île-de-France, France","S23,B2B,Operations"
Raz,AI-Native Qualtrics,"New York, NY, USA","S23,B2B,Operations"
sudocode,code in plain english,"Mountain View, CA, USA","S23,B2B,Engineering, Product and Design"
Sweep,AI-powered Python junior developer for software teams,,"S23,B2B,Engineering, Product and Design"
Silimate,The co-pilot for chip designers,,"S23,B2B,Engineering, Product and Design"
Andromeda Surgical,Autonomous surgical robots,"San Francisco, CA, USA","S23,Healthcare,Medical Devices"
ProdTrace,Keep your NPI programs on schedule and on budget,"San Francisco, CA, USA","S23,B2B,Engineering, Product and Design"
Inari,"AI-powered product discovery, feedback analytics, and backlog","New York, NY, USA","S23,B2B,Engineering, Product and Design"
Roundtable,Developer-friendly survey software,"New York, NY, USA","S23,B2B"
Chatter,Dead simple LLM testing and iteration,"Philadelphia, PA, USA","S23,B2B"
DisputeNinja,We help you win Stripe disputes.,"San Francisco, CA, USA","S23,B2B"
Envelope,Banking with built-in budgeting,"San Francisco, CA, USA","S23,Fintech,Consumer Finance"
VectorShift,No-Code Generative AI Automations Platform,,"S23,B2B,Infrastructure"
SafetyKit,AI-Powered Trust and Safety Automation,,"S23,B2B"
Baserun,Observability and evaluation platform for LLM apps.,"San Francisco, CA, USA","S23,B2B,Engineering, Product and Design"
Automorphic,Infuse knowledge into language models with just 10 samples,"San Francisco, CA, USA","S23,B2B"
Glaze,Shop your fashion inspo,,"S23,Consumer,Apparel and Cosmetics"
Sola,Copilot for Robotic Process Automation,"Jersey City, NJ, USA","S23,B2B"
Inlet,AI-powered dev tool for integrations,"New York, NY, USA","S23,B2B,Engineering, Product and Design"
Converge,Segment for Ecommerce,"London, England, United Kingdom","S23,B2B"
Flint,AI tutoring for schools,"San Francisco, CA, USA","S23,Education"
CambioML,Retrieve and transform data from PDFs and forms,,"S23,B2B"
Osium AI,Speed up materials innovation with Artificial Intelligence,"Paris, Île-de-France, France","S23,B2B"
Slicker,AI-powered payments platform,"London, England, United Kingdom","S23,Fintech,Payments"
Khoj,The open-source AI assistant for your digital brain.,"San Francisco, CA, USA","S23,Consumer"
VaultPay,Digital banking platform for the 30 million smartphone users in DRC.,"Kinshasa, Kinshasa, Democratic Republic of the Congo","S23,Fintech"
Crew,AI platform to hire and onboard your global team,"San Francisco, CA, USA","S23,B2B"
gleam,Seamless benefits in 15 minutes,,"S23,Fintech,Insurance"
Kobalt Labs,AI copilot to automate risk ops for fintechs and banks,"New York, NY, USA","S23,B2B,Operations"
Studdy,An AI math tutor for every student,"San Francisco, CA, USA","S23,Education"
Trainy,Infrastructure for managing GPU clusters for training/serving.,"San Francisco, CA, USA","S23,B2B"
MantleBio,Transform scientific data into discoveries,,"S23,B2B"
Pincites,Close deals faster with AI for contract negotiation,,"S23,B2B,Legal"
Yenmo,Secured consumer lending in India,"Bengaluru, KA, India","W24,Fintech,Credit and Lending"
Apoxy,The Proxy Platform,"San Francisco, CA, USA","S23,B2B,Infrastructure"
sizeless,Make ML models reproducible and safe.,"San Francisco, CA, USA","S23,B2B,Engineering, Product and Design"
Quack AI,Make collaborative software development scale efficiently,"Paris, Île-de-France, France","S23,B2B,Productivity"
Continue,The leading open-source AI code assistant,"San Francisco, CA, USA","S23,B2B,Engineering, Product and Design"
Letter AI,"Empowering B2B sellers with AI-powered training, coaching, and content","Chicago, IL, USA","S23,B2B,Productivity"
Guac,AI-powered demand forecasting for grocery,"New York, NY, USA","S23,B2B,Supply Chain and Logistics"
CareOasis,Helping family caregivers get paid through government programs,"Dover, DE, USA","S23,Healthcare,Consumer Health and Wellness"
Glade,Building the next generation of video games using AI,"San Francisco, CA, USA","S23,Consumer,Gaming"
LifestyleRx,Virtual Care for Type 2 Diabetes Reversal,"White Rock, BC, Canada","S23,Healthcare,Healthcare Services"
Empirical Health,"Proactive primary care, scaled with AI",,"S23,Healthcare,Healthcare Services"
Fortuna Health,TurboTax for Medicaid,"New York, NY, USA","S23,Healthcare,Healthcare IT"
Aglide,"Access management and SSO for any app, without relying on SAML.","London, England, United Kingdom","S23,B2B"
Respaid,Modern B2B Collection (Respectfully with AI),"San Francisco, CA, USA","S23,Fintech"
Vizly,Data to insights in seconds,"San Francisco, CA, USA","S23,B2B,Analytics"
Revideo,Create Videos with Code,"Berlin, Berlin, Germany","S23,B2B,Engineering, Product and Design"
Greenlite,AI agents for financial compliance operations,"San Francisco, CA, USA","S23,Fintech"
MediSearch,Search engine for trustworthy medical information.,"London, England, United Kingdom","S23,Healthcare,Consumer Health and Wellness"
Metalware,Copilot for firmware engineers,,"S23,B2B,Engineering, Product and Design"
Upstream,An email client designed for team collaboration,"Paris, Île-de-France, France","S23,B2B,Productivity"
Maven Bio,AI-enabled BioPharma Industry Research,"Boston, MA, USA","S23,B2B"
Egress Health,End-To-End Revenue Cycle Automation,"San Francisco, CA, USA","S23,Healthcare"
Surface Labs,Building tools to help boost website conversions,,"S23,B2B,Sales"
CandorIQ,Headcount & Compensation Management,"San Francisco, CA, USA","S23,B2B"
refine,Open-source Retool for enterprise,"San Francisco, CA, USA","S23,B2B,Engineering, Product and Design"
Epsilla,A one-stop RAG-as-a-Service platform,"Jersey City, NJ, USA","S23,B2B,Infrastructure"
GovernGPT,AI Back Office for Fund Managers,"Toronto, ON, Canada","W24,Fintech"
Lysto AI,Task automation platform for GTM teams,"New York, NY, USA","S23,B2B"
VetRec,AI Scribe for veterinarians that produces clinical notes in seconds,"Seattle, WA, USA","S23,B2B"
Cleancard,Making cancer detection as easy as a pregnancy test,,"S23,Healthcare,Diagnostics"
Decoda Health,Patient Billing Made Simple,"San Francisco, CA, USA","S23,Healthcare,Healthcare IT"
Skyvern,Open Source AI Agent to automate browser workflows via an API,"San Francisco, CA, USA","S23,B2B,Infrastructure"
Cardinal Gray,Title workflow automation for auto lenders and dealers,"San Francisco, CA, USA","S23,Fintech,Credit and Lending"
Telophase,Reach vulnerability inbox-zero,"New York, NY, USA","S23,B2B,Security"
Dialtone,Data tooling and management platform for all your AI needs,"San Francisco, CA, USA","S23,B2B,Infrastructure"
Transformity,Point-of-sale & Vertical SaaS for the $75B Liquor Industry,,"S23,B2B,Retail"
Repaint,"A visual design tool like Figma, but it makes real websites","Columbus, OH, USA","S23,B2B,Engineering, Product and Design"
Chow Central Inc,Asset Light Restaurant Chains for Africa,"Lagos, LA, Nigeria","S23,Consumer,Food and Beverage"
FleetWorks,Automating the 2B phone calls and emails that keep freight moving,,"S23,B2B,Supply Chain and Logistics"
Menza,Your AI Data Analyst,"London, England, United Kingdom","S23,B2B,Analytics"
Health Harbor,Using generative AI to call insurance for healthcare clinics,"San Francisco, CA, USA","S23,Healthcare,Healthcare IT"
Briefer,The collaborative data platform.,"São Paulo, SP, Brazil","S23,B2B,Engineering, Product and Design"
Shasta Health,AI platform for physical therapists to go independent,"San Francisco, CA, USA","S23,Healthcare,Healthcare Services"
Hegel AI,Open source tools for developing generative AI applications,,"S23,B2B,Infrastructure"
Outset,AI-powered user interviews,"San Francisco, CA, USA","S23,B2B,Analytics"
Serra,AI-powered candidate search,"San Francisco, CA, USA","S23,B2B,Recruiting and Talent"
Corgea,Fix vulnerable code using AI,"San Francisco, CA, USA","S23,B2B,Security"
Terminal,Plaid for Telematics Data in Commercial Trucking,"Toronto, ON, Canada","S23,B2B,Supply Chain and Logistics"
MICSI,Higher resolution MRI with faster scan times.,"New York, NY, USA","S23,Healthcare,Diagnostics"
CraftOS,Inventory Management and POS for the Wine industry,"San Francisco, CA, USA","S23,B2B,Retail"
Arcimus,AI Powered Insurance Premium Audits,"San Francisco, CA, USA","S23,B2B"
Docsum,AI contract review & negotiation,"San Francisco, CA, USA","S23,B2B,Legal"
Obento Health,Patient Engagement Platform That Pays,"San Francisco, CA, USA","S23,Healthcare,Consumer Health and Wellness"
Kite,Apple-style product videos in minutes,"San Francisco, CA, USA","S23,B2B,Marketing"
Bronco AI,The Modern Industrial Operating Stack,"San Francisco, CA, USA","S23,B2B,Operations"
Agentive,AI-powered auditing platform,,"S23,B2B,Finance and Accounting"
venta,Find and reach leads with buying intent in Europe,"Munich, BY, Germany","S23,B2B,Sales"
Parea,"Test, evaluate & observe your LLM applications","New York, NY, USA","S23,B2B,Operations"
Campfire,A modern version of NetSuite,"San Francisco, CA, USA","S23,B2B,Finance and Accounting"
Alguna,"Modern SaaS Pricing, Quoting & Billing Platform","San Francisco, CA, USA","S23,B2B,Finance and Accounting"
SID,"Serverless RAG to connect AI to company, industry, or person-specific…","San Francisco, CA, USA","S23,B2B,Engineering, Product and Design"
Capi Money,Helping businesses in Africa pay their international suppliers,,"S23,Fintech,Payments"
SuperCraft,The new way to design physical products,"New York, NY, USA","S23,B2B,Engineering, Product and Design"
Spine AI,Reliable AI data analysts that know your business,"San Francisco, CA, USA","S23,B2B"
Empower,Developer platform for fine-tuned LLMs,"San Mateo, CA, USA","S23,B2B,Infrastructure"
Subsets,AI-driven retention automation for subscription media.,"Copenhagen, Denmark","S23,B2B"
Tegon,Open source issue tracking tool for engineering teams,"San Francisco, CA, USA","S23,B2B,Productivity"
Synch,Supercharging Sales,"New York, NY, USA","S23,B2B,Sales"
Revamp,AI-Powered Customer Segmentation for eCommerce,"San Francisco, CA, USA","S23,B2B,Analytics"
DataShare,"Embed charts, dashboards and exports in your app","Austin, TX, USA","S23,B2B,Engineering, Product and Design"
Airgoods,Faire for specialty food stores,"New York, NY, USA","S23,B2B,Retail"
Talc,Helping companies use their data to build better AI models,"Seattle, WA, USA","S23,B2B,Engineering, Product and Design"
Solve Intelligence,We use AI to help attorneys write patents.,,"S23,B2B,Legal"
askLio,AI-Copilot for procurement teams at large enterprises,"San Francisco, CA, USA","S23,B2B"
Craftwork,Digital-native home painting franchise,"Charlotte, NC, USA","S23,Real Estate and Construction,Construction"
Electric Air (Previously Helios Climate),Tech-enabled heat pump contractor that cuts costs by 60%,"San Francisco, CA, USA","S23,Real Estate and Construction,Construction"
Mandel AI,AI Procurement Agent for Manufacturing,"San Francisco, CA, USA","S23,B2B,Supply Chain and Logistics"
Every,Banking + Payroll/Benefits + Bookkeeping + Tax in one place,Remote,"S23,B2B"
Contour,Automated QA Copilot,"San Francisco, CA, USA","S23,B2B"
Atla,We train frontier models to evaluate generative AI,"London, England, United Kingdom","S23,B2B"
