name,Description,Location,tags
Billforward,"Subscription billing, rate plan management and analytics as a…","San Francisco, CA, USA","S14,Fintech,Payments"
Backpack,Marketplace to get stuff from overseas,"San Francisco, CA, USA","S14,Consumer,Home and Personal"
Aptible,The No Infrastructure Platform as a Service,"San Francisco, CA, USA","S14,B2B,Infrastructure"
Immunity Project,The free HIV vaccine.,"San Francisco, CA, USA","W14,Unspecified"
Dyspatch,Two products to help everyone email better. Dyspatch.io - Email…,"Victoria, BC, Canada","W14,B2B,Marketing"
OpenCurriculum,Helping K-12 teachers and school administrators build awesome…,"Mountain View, CA, USA","W14,Unspecified"
MixerBox,AI Super-Apps to Live Easier | The anything anytime superapps…,"Palo Alto, CA, USA","W14,Consumer"
Unbabel,AI-powered Language Operations platform,"San Francisco, CA, USA","W14,B2B,Operations"
Y Combinator,Not your average fixed point combinator.,"Mountain View, CA, USA",Fintech
GBatteries,Enabling li-ion batteries to charge ultra fast without compromising…,"Ottawa, ON, Canada","W14,Industrials,Climate"
Zinc,The secret backbone of e-commerce. ,"San Francisco, CA, USA","W14,B2B,Retail"
Zidisha,Direct P2P lending across the international wealth divide.,"Sterling, VA, USA","W14,Fintech,Credit and Lending"
TrueVault,We make Privacy Software for SMBs.,"San Francisco, CA, USA","W14,B2B"
Guesty,The management platform for the short term rental industry.,"Tel Aviv-Yafo, Tel Aviv District, Israel","W14,Real Estate and Construction,Housing and Real Estate"
Snapdocs,Digital mortgage closing,"San Francisco, CA, USA","W14,Real Estate and Construction,Housing and Real Estate"
Medmonk,A tool for pharmacists to find funding for patients who are unable to…,"Milpitas, CA, USA","W12,Healthcare,Healthcare Services"
Shoobs,We help you find and book tickets to great entertainment events that…,"London, England, United Kingdom","W14,Consumer,Travel, Leisure and Tourism"
Pushbullet,Push things to your other things.,"San Francisco, CA, USA","W14,Consumer,Home and Personal"
Povio,Engineering and Design that Fuels Startup Success,"San Francisco, CA, USA","W14,B2B,Engineering, Product and Design"
PiinPoint,PiinPoint helps businesses find the best locations for growth,"Kitchener, ON, Canada","W14,B2B,Office Management"
Theorem,The mission of Theorem is to make credit safe and available. We use…,"San Francisco, CA, USA","W14,Fintech,Asset Management"
One Degree,One Degree is a nonprofit organization that makes it easy for…,"San Francisco, CA, USA","W14,Unspecified"
MBX,A global multi-brand beauty and personal care startup.,"San Francisco, CA, USA","W14,Consumer,Apparel and Cosmetics"
Emailio,Email built for wellness,Remote,"W14,B2B,Productivity"
DevCycle,Feature Flag Management Built for Developers,"Toronto, ON, Canada","W14,B2B,Engineering, Product and Design"
Axoni,Axoni is building the next generation of capital markets technology,"New York, NY, USA","W14,Fintech,Banking and Exchange"
CodeNow,Our mission is to diversify the talent pipeline of students who…,"Chicago, IL, USA","W14,Unspecified"
CodeCombat,Game that teaches computer science to middle and high school kids.,"San Francisco, CA, USA","W14,Education"
Noora Health,Training patients and their families with health skills,"Bengaluru, KA, India","W14,Unspecified"
Cambly,On-demand access to English tutors over video chat.,"San Francisco, CA, USA","W14,Education"
AptDeco,AptDeco is the easiest way to buy and sell used furniture,"New York, NY, USA","W14,Consumer,Home and Personal"
CareMessage,Patient engagement using text messaging,"San Francisco, CA, USA","W14,Healthcare"
Ambition,Coaching and gamification software for sales teams. ,"Chattanooga, TN, USA","W14,B2B,Sales"
AirHelp,"AirHelp helps air passengers get compensation for delayed, cancelled…","Berlin, Berlin, Germany","W14,Consumer,Travel, Leisure and Tourism"
42,Analytics stack for omnichannel retailers and brands,"San Francisco, CA, USA","W14,B2B,Retail"
True Link,Financial Services for Financial Caregivers. ,"San Francisco, CA, USA","S13,Fintech"
Reebee,Flyer app.,"Kitchener, ON, Canada","S13,Consumer,Home and Personal"
Lob,Lob is the only automation platform that transforms direct mail into…,"San Francisco, CA, USA","S13,B2B,Marketing"
Panorama Education,Improving education for every student.,"Boston, MA, USA","S13,Education"
Cratejoy,Cratejoy is the platform for subscriptions,"Austin, TX, USA","S13,B2B,Retail"
"Estimote, Inc.",Location intelligence platform,"Kraków, Lesser Poland Voivodeship, Poland","S13,B2B,Supply Chain and Logistics"
EasyPost,The shipping infrastructure of the internet.,"San Francisco, CA, USA","S13,B2B,Supply Chain and Logistics"
Asseta,Marketplace for industrial spare parts and capital equipment.,"Newport Beach, CA, USA","S13,B2B"
Per Vices,Building Mission Critical Software Defined Radio products.,"Toronto, ON, Canada","W12,Industrials"
7cups,7 Cups is an emotional support service that matches up people that…,"Virginia Beach, VA, USA","S13,Healthcare,Healthcare Services"
Watsi,Watsi is the first global crowdfunding platform for medical…,"San Francisco, CA, USA","W13,Healthcare"
Goldbelly,Empowering restaurants and small food makers to ship nationwide.,"New York, NY, USA","W13,Consumer,Food and Beverage"
Wevorce,Changing divorce for good by making it a way less horrible experience…,"Bothell, WA, USA","W13,Consumer,Home and Personal"
Wefunder,We're Robinhood for pre-IPO startups. Everyone can invest $100.,"San Francisco, CA, USA","W13,Fintech,Asset Management"
SimplyInsured,We sell health insurance to small businesses 100% online.,"San Francisco, CA, USA","W13,Healthcare,Healthcare Services"
CircuitHub,Electronics factory automation,"London, England, United Kingdom","W12,Industrials,Manufacturing and Robotics"
Experiment,crowdfunding platform for science,"Honolulu, HI, USA","W13,Healthcare,Healthcare Services"
RADAR,RADAR is building technology to completely transform the in-store…,"New York, NY, USA","W13,B2B,Retail"
Lollipuff,Online Auctions for Authentic (Women's) Designer Goods,"Mountain View, CA, USA","W13,Consumer,Apparel and Cosmetics"
Strikingly,"The easiest way to create a beautiful, mobile optimized website.","Shanghai, Shanghai, China","W13,B2B,Marketing"
InfluxData,The platform for building and operating time series applications.,"San Francisco, CA, USA","W13,B2B,Infrastructure"
Etleap,Etleap is an ETL solution for creating perfect data pipelines. ,"San Francisco, CA, USA","W13,B2B,Infrastructure"
Cheetah,"Fastest, easiest, and most affordable way for small business owners…","San Francisco, CA, USA","W13,B2B,Retail"
Lawdingo,Lawdingo provides virtual paralegal services to law firms.,"New York, NY, USA","W13,Consumer,Home and Personal"
Padlet,Papyrus → Parchment → Paper → Padlet,"San Francisco, CA, USA","W13,B2B,Productivity"
BuildZoom,BuildZoom is a better way to remodel. We connect homeowners to the…,"San Francisco, CA, USA","W13,Consumer,Home and Personal"
Monzo Bank,A bank as smart as your phone.,"London, England, United Kingdom","Fintech,Consumer Finance"
Scuba,Hadoop for impatient people.,"Redwood City, CA, USA","W13,B2B,Analytics"
CircuitLab,Online circuit simulator and electronic schematic editor.,"Redwood City, CA, USA","W13,B2B,Engineering, Product and Design"
9gag,Make the world happier.,"Hong Kong, Hong Kong","S12,Consumer,Social"
Svbtle,A publishing platform.,"San Francisco, CA, USA","S12,Consumer,Content"
Plivo,"Plivo enables businesses to add SMS, Voice capability into their apps.","Austin, TX, USA","S12,B2B,Engineering, Product and Design"
Double Robotics,Telepresence robots,"Burlingame, CA, USA","S12,B2B,Productivity"
Vastrm,Mass customized active apparel. We are building a full turn key…,"Burlingame, CA, USA","S12,Consumer,Apparel and Cosmetics"
Flightfox,"A platform to plan, book and manage global and group travel.","Boulder, CO, USA","S12,B2B,Operations"
BackerKit,BackerKit is crowdfunding software that helps project creators manage…,"San Francisco, CA, USA","S12,B2B,Sales"
Submittable,"The best way to launch, manage and measure social impact programs","Missoula, MT, USA","S12,B2B"
NewsBlur,NewsBlur is an RSS news reader with intelligence.,"Cambridge, MA, USA","S12,Consumer,Content"
OctaveWealth,The 401(k) that helps you grow,"San Francisco, CA, USA","S12,B2B,Human Resources"
Upwave,Marketing analytics for the world's biggest brand marketers,"San Francisco, CA, USA","S12,B2B,Operations"
Eligible,Insurance Billing APIs for Healthcare Businesses ,"NY, USA","S12,Healthcare,Healthcare IT"
FundersClub,Online VC,"San Francisco, CA, USA","S12,Fintech,Asset Management"
Zentail,We're making ecommerce simple connecting brands with sales channels,"Columbia, MD, USA","S12,B2B,Supply Chain and Logistics"
Mattermost,Secure Collaboration for Technical Teams,"Palo Alto, CA, USA","S12,B2B,Productivity"
HealthSherpa,Private sector Healthcare.gov. ,"Sacramento, CA, USA","S12,Healthcare,Healthcare Services"
Human Dx,The Human Diagnosis Project.,"San Francisco, CA, USA","S12,Healthcare,Healthcare IT"
Mth Sense,We're a mobile on-device profiling and ad-serving platform initially…,"San Jose, CA, USA","S12,B2B,Marketing"
Rainforest,no-code end-to-end testing that integrates with any CI/CD pipeline,"San Francisco, CA, USA","S12,B2B,Engineering, Product and Design"
Screenleap,One-click screen sharing with installation-free viewing on all devices,"San Carlos, CA, USA","W12,B2B,Productivity"
Buxfer,Buxfer helps you make better spending decisions by making it easy to…,"Santa Clara, CA, USA","W07,Fintech,Consumer Finance"
Virtualmin,,"Mountain View, CA, USA","W07,B2B,Infrastructure"
Blue Frog Gaming,,"Akron, OH, USA","S07,Consumer,Gaming"
CleverDeck,Collaborate with an artist to commission original artwork you'll live…,"Istanbul, Istanbul, Turkey","W12,Education"
Shoptiques,Shoptiques.com lets you shop the world's best local boutiques online.,"New York, NY, USA","W12,Consumer,Apparel and Cosmetics"
Ninite,Simple third-party app patching and deployment for Windows.,"San Francisco, CA, USA","W08,B2B,Infrastructure"
RescueTime,Take Back Control of your Time,"Seattle, WA, USA","W08,B2B,Productivity"
Outerport,VMware for GPUs,"San Francisco, CA, USA","S24,B2B,Infrastructure"
DreamRP,Character AI meets Patreon,"San Francisco, CA, USA","S24,Consumer"
Melty,Open source AI code editor for 10x engineers,"San Francisco, CA, USA","S24,B2B,Engineering, Product and Design"
Syntra,First AI-Native EHR That Automates Back-Office for Doctors,"San Francisco, CA, USA","S24,Healthcare,Healthcare IT"
PathPilot,Turn Session Replays into Actionable Insights ,"San Francisco, CA, USA","S24,B2B"
Standard Data,Building LLM connectors to integrate manufacturing data.,"San Francisco, CA, USA","S24,B2B"
Kairo Health,The AI healthcare workforce,"New York, NY, USA","S24,Healthcare,Healthcare IT"
Midship,Extract documents straight to your spreadsheets,"San Francisco, CA, USA","S24,B2B,Finance and Accounting"
Soma Lab,Simulated patients to scale medical education.,"San Francisco, CA, USA","S24,Healthcare"
Merlin AI,AI powered ERP for Construction,"Los Angeles, CA, USA","S24,B2B"
Freestyle,Build exceptional infrastructure with just JavaScript.,"San Francisco, CA, USA","S24,B2B,Infrastructure"
Arva AI,AI agents for instant business verification,"San Francisco, CA, USA","S24,B2B"
Affil.ai,AI Compliance For Financial Affiliate Marketing,"San Francisco, CA, USA","S24,B2B,Marketing"
OrgOrg,Organizational productivity suite for companies,"Los Altos, CA, USA","S24,B2B,Productivity"
Patched,Open-source workflow automation for dev teams,"San Francisco, CA, USA","S24,B2B,Productivity"
Village Labs,Helping America's businesses become employee owned,"New York, NY, USA","S24,B2B,Human Resources"
Mica AI,Turn Sales Calls into Personalized Deal Summary Pages,"San Francisco, CA, USA","S24,B2B,Sales"
Formula Insight,"Database for Hedge Funds to store, query and analyze financial models",,"S24,B2B"
Overlap,A new podcast app that uses AI to curate the best moments for you.,,"S24,Consumer,Content"
Capitol AI,Infinitely smart research assistant that generates content from data,"Washington, DC, USA","S24,B2B,Productivity"
Kart AI,The AI shopping assistant for all e-commerce brands,"San Francisco, CA, USA","S24,B2B,Engineering, Product and Design"
Anglera,Plaid for E-Commerce Data,"San Francisco, CA, USA","S24,B2B,Retail"
XTraffic,Technology for cities to automate and manage their traffic lights.,"Dallas, TX, USA","S24,Government"
Felafax,Building AI Infra for non-NVIDIA GPUs ,"San Francisco, CA, USA","S24,B2B,Infrastructure"
Henry,Generative AI for Commercial Real Estate Professionals,"New York, NY, USA","S24,Real Estate and Construction"
Hey Revia,Voice AI to automate complex phone calls for healthcare providers,"San Francisco, CA, USA","S24,B2B"
Ficra,"Visual map of every ad, email, flow, and screen your users see.","San Francisco, CA, USA","S24,B2B"
RowBoat Labs,LLM Agents for Customer Support,"San Francisco, CA, USA","S24,B2B"
Pipeshift AI,Fine-tuning and Inferencing for Open-source LLMs.,"San Francisco, CA, USA","S24,B2B,Infrastructure"
Vera Health,Providing AI agents to healthcare companies ,"San Francisco, CA, USA","S24,Healthcare,Healthcare Services"
Pharos,Automating hospital reporting and preventing patient harm with AI,"San Francisco, CA, USA","S24,Healthcare,Healthcare IT"
et al.,Daily feed of insights extracted from your go-to sources using LLMs.,,"S24,Consumer"
Affix API,API for data migrations for HR/Payroll companies,"San Francisco, CA, USA","S24,B2B,Engineering, Product and Design"
Keet,Integrate with the Internet,,"S24,B2B"
Terra,"Terra simplifies product design, manufacturing, and sourcing for SMBs","New York, NY, USA","S24,B2B,Supply Chain and Logistics"
AI Sell,AI Sales Associate for Ecommerce,"San Francisco, CA, USA","S24,B2B,Operations"
"Diode Computers, Inc.",Automate Hardware Engineering using AI,"New York, NY, USA","S24,B2B,Engineering, Product and Design"
SureBright,Offer your own Apple Care-like warranty program in 10 minutes!,"New York, NY, USA","S24,B2B,Retail"
Usul,AI Insights for Defense Contractors,"San Francisco, CA, USA","S24,B2B"
Saldor,The web scraper for AI,"San Francisco, CA, USA","S24,B2B,Engineering, Product and Design"
Bucket Robotics,Defect detection for manufacturing built from CAD and synthetic data.,"Pittsburgh, PA, USA","S24,Industrials,Manufacturing and Robotics"
Oway,Ridesharing freight with ML to cut SMB shipping costs by 50%,"San Francisco, CA, USA","S24,B2B,Supply Chain and Logistics"
Elayne,AI estate planner & executor for employees and their families,"Denver, CO, USA","S24,B2B,Human Resources"
Blaze,Global Venmo for cross border payments,"Mexico City, CDMX, Mexico","S24,Fintech,Payments"
pap!,The world owes you money. We get it for you.,"Berkeley, CA, USA","S24,Consumer"
Mindely,The first GenAI interviewer conducting complex business interviews,"San Francisco, CA, USA","S24,B2B"
TradeFlow,We build AI software to automate stock trade settlement.,"New York, NY, USA","S24,Fintech"
Voker,No-Code AI Builder,"San Francisco, CA, USA","S24,B2B,Engineering, Product and Design"
Rastro,Your personal interior designer.,"San Francisco, CA, USA","S24,Consumer"
Quetzal,"Simple, LLM-first translation and internationalization for software","Oakland, CA, USA","S24,B2B,Engineering, Product and Design"
Weavel,Performance analytics & testing for LLM applications  🔍,"San Francisco, CA, USA","S24,B2B,Engineering, Product and Design"
Moreta,Payments made easy for international travelers.,,"S24,Fintech,Payments"
Focus Buddy,AI Productivity Coach: Get work done when you are struggling to focus,"San Francisco, CA, USA","S24,Consumer,Content"
Simplifine,AI-powered workspace for research,"San Francisco, CA, USA","S24,Consumer"
Sepal AI,The data development platform for LLM users and builders.,"San Francisco, CA, USA","S24,B2B"
Assembly HOA,AI-enabled HOA management,"Los Angeles, CA, USA","S24,Real Estate and Construction,Housing and Real Estate"
autarc,autarc is the OS for HVAC installers to install more heat pumps,,"S24,B2B"
omnidock,Sell on all eCommerce marketplaces globally,"Berlin, Berlin, Germany","S24,B2B,Operations"
Polymet,An AI that can design and code,"San Francisco, CA, USA","S24,B2B,Engineering, Product and Design"
Kontigo,USDC-Smart Neobank for Latinos. ,"San Francisco, CA, USA","S24,Fintech,Banking and Exchange"
Remo,AI for compliance teams at banks,"San Francisco, CA, USA","S24,Fintech"
Propaya,AI-powered software to automate property management.,"San Francisco, CA, USA","S24,Real Estate and Construction,Housing and Real Estate"
Vendra,AI vendor and project management for hardware teams,"San Francisco, CA, USA","S24,B2B,Engineering, Product and Design"
Argil,The video generation engine for the creator economy ,"Paris, Île-de-France, France","S24,Consumer"
ZeroPath,"Automatically find, verify, and fix web app vulnerabilities","San Francisco, CA, USA","S24,B2B,Security"
Actionbase,Making the web agent-interpretable. ,"San Francisco, CA, USA","S24,B2B,Engineering, Product and Design"
Corpdaq,Stripe of Lending for Asia,"Singapore, Singapore","S24,Fintech"
Lumen Orbit,Data centers in space,"Redmond, WA, USA","S24,Industrials,Aviation and Space"
Dataleap,Perplexity for Consultants,"San Francisco, CA, USA","S24,B2B"
Zimi,Amazon-like fulfillment for exporters in emerging markets,,"S24,B2B,Supply Chain and Logistics"
Thyme,Meeting intelligence for financial advisors.,"San Francisco, CA, USA","S24,B2B,Finance and Accounting"
Ionworks,Build and run battery simulations at scale,"Pittsburgh, PA, USA","S24,Industrials,Energy"
Rescript,Regulatory and Policy Intelligence for Law and Government Relations,,"S24,B2B,Legal"
Zigma - by NextUI,Design system creation & management platform.,"San Francisco, CA, USA","S24,B2B,Engineering, Product and Design"
Helium,AI App Monetization ,"San Francisco, CA, USA","S24,B2B,Engineering, Product and Design"
&AI,The definitive platform for patent due diligence,"San Francisco, CA, USA","S24,B2B,Legal"
Haystack Software,Visualize and edit your codebase on an infinite canvas,"San Francisco, CA, USA","S24,B2B,Engineering, Product and Design"
Finosu,Compliance automation for the credit industry,,"S24,Fintech,Credit and Lending"
Odo,Help companies find and win government contracts with AI,"New York, NY, USA","S24,Government"
Baseline AI,AI document creation and data management for clinical trials,"San Francisco, CA, USA","S24,Healthcare,Healthcare IT"
Zephr,AI customer success manager,"San Francisco, CA, USA","S24,B2B"
Winford AI,AI-Powered Software for Institutional Credit Investors,"New York, NY, USA","S24,B2B,Productivity"
Cartage,Autonomous freight operations,,"S24,B2B,Supply Chain and Logistics"
Paasa,Invest in US markets from emerging economies,"Gurugram, HR, India","S24,Fintech,Asset Management"
Blast,Helping enterprises build safe and compliant LLM apps/agents,"San Francisco, CA, USA","S24,B2B,Security"
Lilac Labs,We automate the person taking orders at drive-thrus with a voice AI,"San Francisco, CA, USA","S24,B2B"
Palmier,AI Native Github Alternative,"San Francisco, CA, USA","S24,B2B,Productivity"
Simple AI,Better Siri,"San Francisco, CA, USA","S24,Consumer"
Sensei,Robotic Training Data at Scale,"San Francisco, CA, USA","S24,Industrials,Manufacturing and Robotics"
Guardian RF,Drone detection and signal intelligence for US defense. ,"San Francisco, CA, USA","S24,Industrials,Drones"
Laminar AI,Open-source DataDog + PostHog for complex AI agents,"San Francisco, CA, USA","S24,B2B,Engineering, Product and Design"
Cerulion,Cross-platform robot middleware with no-code GUI,,"S24,B2B"
Presti AI,Product photography for furniture companies with generative AI,,"S24,B2B,Retail"
The Forecasting Company,New foundation models for time series,"Paris, Île-de-France, France","S24,B2B"
Praxos,AI workbench for insurance teams,"Miami, FL, USA","S24,B2B"
Exa Laboratories,Energy efficient chips for AI,"San Francisco, CA, USA","S24,Industrials"
SchemeFlow,Automate the technical reports required for construction projects.,,"S24,Real Estate and Construction"
Brighterway,Automating the workers-compensation claims review process,,"S24,Healthcare,Healthcare IT"
Mineflow,Mineflow predicts the shape and location of mineral deposits,,"S24,Industrials"
Soff,Supply chain operating system for manufacturing companies.,"San Francisco, CA, USA","S24,B2B,Supply Chain and Logistics"
Parley,Automating visa applications,"San Francisco, CA, USA","S24,B2B,Legal"
Intryc,Intryc uses AI to automate quality assurance for customer support,"San Francisco, CA, USA","S24,B2B,Operations"
Pinnacle,Next Generation SMS Marketing,"San Francisco, CA, USA","S24,B2B,Marketing"
Ember Robotics,Camera diagnostics for robots,"San Francisco, CA, USA","S24,Industrials,Manufacturing and Robotics"
Thunder Compute,Cloud Computing Technology to virtualize GPUs over TCP.,"Atlanta, GA, USA","S24,B2B,Infrastructure"
Zeit AI,Insights from tabular data in just a few words.,"San Francisco, CA, USA","S24,B2B,Analytics"
Remade,Automating Video Ad Workflows using AI,"San Francisco, CA, USA","S24,B2B,Marketing"
Distro,The AI co-pilot for sales reps at industrial wholesale distributors.,"New York, NY, USA","S24,B2B,Supply Chain and Logistics"
Modern Realty,The AI real estate agent for home buying,"San Francisco, CA, USA","S24,Real Estate and Construction,Housing and Real Estate"
David AI,Data for multimodal AI,"San Francisco, CA, USA","S24,B2B"
BeeBettor,Robinhood for sports betting,,"S24,Consumer,Content"
Guardian AI,Helping healthcare providers fight insurance denials.,"New York, NY, USA","S24,Healthcare"
Stempad,Notion for science,,"S24,B2B,Productivity"
Pax,TurboTax for Import Duty Rebate,,"S24,B2B,Supply Chain and Logistics"
Conductor Quantum,Quantum computers on silicon chips using AI.,"San Francisco, CA, USA","S24,Industrials"
Autumn Labs,A platform to monitor and manage industrial robots and test stations.,"San Francisco, CA, USA","S24,Industrials,Manufacturing and Robotics"
Opslane,Open-source tool to reduce noisy alerts,"San Francisco, CA, USA","S24,B2B,Infrastructure"
Asterisk,AI-augmented security audits for modern development teams.,,"S24,B2B,Security"
Biocartesian,Converting biology into digital molecular maps,"San Francisco, CA, USA","S24,Healthcare,Drug Discovery and Delivery"
Seals AI,AI Employees for Wholesalers,"San Francisco, CA, USA","S24,B2B"
deepsilicon,Software and hardware to run neural networks faster and cheaper,"San Francisco, CA, USA","S24,Industrials"
Drillbit,Automating Office Work for Residential Contractors.,"Austin, TX, USA","S24,B2B,Operations"
Lumenary,AI-powered quality reporting for healthcare.,"San Francisco, CA, USA","S24,Healthcare"
Dimely,AI Copilot for B2B SaaS Billing Teams,"San Francisco, CA, USA","S24,B2B,Finance and Accounting"
Redouble AI,Automated Quality Control for AI Workflows in Regulated Industries,"San Francisco, CA, USA","S24,B2B"
Planbase,Workforce management for modern healthcare ,"San Francisco, CA, USA","S24,Healthcare,Healthcare IT"
Unriddle,Read and write research papers faster.,"San Francisco, CA, USA","S24,Consumer"
"Hestus, Inc.",An AI-powered CAD software,"San Francisco, CA, USA","S24,B2B,Engineering, Product and Design"
MagiCode,Proactive AI Pair Programmer,"Stanford, CA, USA","S24,B2B,Engineering, Product and Design"
FINNY AI,Using ML to supercharge organic growth for Financial Advisors,"New York, NY, USA","S24,Fintech,Asset Management"
Focal,AI automation for enterprises,"San Francisco, CA, USA","S24,B2B,Operations"
1849 bio,We make microbes enabling ultra cheap metal extraction.,"San Francisco, CA, USA","S24,Industrials"
ReactWise,AI co-pilot for chemical reaction optimization,,"S24,B2B,Engineering, Product and Design"
Olive Legal,AI medical summaries for personal injury lawyers.,"San Francisco, CA, USA","S24,B2B,Legal"
Saturn,Backoffice and compliance automation for wealth managers,"London, England, United Kingdom","S24,Fintech"
Clearly AI,Automate software security and privacy reviews,"Seattle, WA, USA","S24,B2B,Security"
expand.ai,The scraper to power your AI apps,"San Francisco, CA, USA","S24,B2B"
Overstand Labs,The cross-selling engine for enterprise software companies,,"S24,B2B,Sales"
Promi,"Optimizing ecommerce merchant pricing with dynamic, personalized…","San Francisco, CA, USA","S24,B2B,Retail"
Ontra Mobility,Platform for planning and operating multimodal transit systems,"New York, NY, USA","S24,Government"
Fortress,Tenant isolation simplified for SaaS,"San Francisco, CA, USA","S24,B2B,Engineering, Product and Design"
Panora,Open source integrations platform for the LLM era,"San Francisco, CA, USA","S24,B2B"
Manaflow,Automate repetitive office work in tables with AI,"San Francisco, CA, USA","S24,B2B"
Conveo,Qualitative Research Conducted and Analyzed by AI,"San Francisco, CA, USA","S24,B2B"
Parity,The World's First AI SRE,"San Francisco, CA, USA","S24,B2B"
Kastle,AI voice agents for mortgage servicing,"San Francisco, CA, USA","S24,B2B"
Kopra Bio,Viral immunotherapies that turn cancer cells into biofactories,"San Francisco, CA, USA","S24,Healthcare,Therapeutics"
Anthrogen,"Scalable, carbon-negative polymer manufacturing.","New York, NY, USA","S24,Industrials,Climate"
Benchify,Automatic code reviews powered by rocket-grade testing,"San Francisco, CA, USA","S24,B2B"
Fazeshift,AI agent for Accounts Receivable,"San Francisco, CA, USA","S24,B2B,Finance and Accounting"
TaxGPT,AI Co-Pilot for Accountants and Tax Professionals,"San Francisco, CA, USA","S24,B2B,Finance and Accounting"
Zenbase AI,Continuous prompt optimization for LLMs from DSPy core contributors,"San Francisco, CA, USA","S24,B2B,Engineering, Product and Design"
Taxo,Automated medical billing and coding,"San Francisco, CA, USA","S24,Healthcare"
Mito Health,AI-powered concierge doctor,"San Francisco, CA, USA","S24,Healthcare,Consumer Health and Wellness"
