name,Description,Location,tags
Lighthouz AI,AI agents to automate procurement for manufacturers,"San Francisco, CA, USA","S24,B2B"
Modus,Headcount management to save costs as you scale,Remote,"S24,B2B"
dmodel,Look inside the model,"San Francisco, CA, USA","S24,B2B,Engineering, Product and Design"
LedgerUp,Your first and only finance hire,"San Francisco, CA, USA","S24,B2B,Finance and Accounting"
Plume,Home energy renovations made easy,"San Francisco, CA, USA","S24,Industrials,Climate"
Pulse AI,Procurement on autopilot,"San Francisco, CA, USA","S24,B2B,Supply Chain and Logistics"
AutoPallet Robotics,We make robots that move boxes in warehouses,"San Francisco, CA, USA","S24,Industrials,Manufacturing and Robotics"
stormy.ai,AI layer on top of MacOS that knows you on an unparalleled level,"San Francisco, CA, USA","S24,Consumer"
Merse,Discover and Create Audio-Visual Comics,"San Francisco, CA, USA","S24,Consumer"
AminoAnalytica,AI for enhanced functional proteins,"San Francisco, CA, USA","S24,Healthcare,Industrial Bio"
Gauge,Solving the monolith/microservices dilemma,"San Francisco, CA, USA","S24,B2B,Engineering, Product and Design"
Weave Robotics,Personal robots for the home--that ship in 2025,"San Francisco, CA, USA","S24,Industrials,Manufacturing and Robotics"
Tandem,Marketplace to help companies lease and share office space,"San Francisco, CA, USA","S24,B2B,Office Management"
AnswerGrid,Accelerate your web research.,"San Francisco, CA, USA","S24,B2B,Productivity"
Tivara,Using LLMs to automate insurance approval for healthcare clinics,,"S24,Healthcare"
MinusX,AI Data Scientist for Jupyter and Metabase,"San Francisco, CA, USA","S24,B2B,Analytics"
Snowpilot,The data warehouse that's as simple as a spreadsheet,"San Francisco, CA, USA","S24,B2B"
Passage,"Clear your goods in minutes, with AI ","San Francisco, CA, USA","S24,B2B,Supply Chain and Logistics"
Parahelp,"The AI support agent used by Perplexity, Captions, and other AI…","San Francisco, CA, USA","S24,B2B,Operations"
CodeViz,We build codebase maps for developers,"San Francisco, CA, USA","S24,B2B,Productivity"
Neuralize,Ship better on-device AI faster and without the hassle,,"S24,B2B,Engineering, Product and Design"
Ares Industries,Building low-cost cruise missiles ,"El Segundo, CA, USA","S24,Industrials,Aviation and Space"
Dodo,AI Receptionists for Medical Front Desks,"San Francisco, CA, USA","S24,Healthcare,Healthcare IT"
Driftly,AI-native EHR for home health agencies,,"S24,B2B,Operations"
Elevate,Financial infrastructure for AI agents,"New York, NY, USA","S24,Fintech,Payments"
Offstream,Vanta for carbon compliance,"San Francisco, CA, USA","S24,B2B"
Storia AI,AI pair programmer for engineering teams using all the world’s code,"Millbrae, CA, USA","S24,B2B,Engineering, Product and Design"
"DeepSim, Inc.",An AI physics simulator for AI chip design,"Mountain View, CA, USA","S24,B2B,Productivity"
reworks,Browser-based integrations that don't break,"San Francisco, CA, USA","S24,B2B,Productivity"
Zuni,Smarter email for founders,Remote,"S24,B2B,Productivity"
Proxis,The platform for LLM distillation and serving.,"San Francisco, CA, USA","S24,B2B,Engineering, Product and Design"
Rewbi,Rewbi uses AI to increase grid-connected battery storage revenue 2x,"San Francisco, CA, USA","S24,Industrials,Energy"
Willow,AI-powered Revenue Cycle Management for Long-term Care,"Palo Alto, CA, USA","S24,B2B"
Aviary,AI-based video search for large video collections.,"San Francisco, CA, USA","S24,B2B,Infrastructure"
NetworkOcean,We build and operate underwater data centers.,"San Francisco, CA, USA","S24,Industrials,Climate"
Silurian,Foundation models to simulate Earth,"Kirkland, WA, USA","S24,Industrials,Climate"
Kura,The AI DevOps Copilot,"San Francisco, CA, USA","S24,B2B,Engineering, Product and Design"
Unbound Security,Secure Gen AI apps for the modern enterprise,"San Francisco, CA, USA","S24,B2B,Security"
RetroFix AI,Turbo Tax for Building Rebates,"San Francisco, CA, USA","S24,B2B"
Azalea Robotics Corporation,Azalea Robotics automates airport baggage handling with robots.,"Berkeley, CA, USA","S24,Industrials,Manufacturing and Robotics"
Decisional AI,AI Agent for Financial Analysts,"San Francisco, CA, USA","S24,Fintech"
Moonglow,Connecting local Jupyter notebooks to remote cloud compute.,"San Francisco, CA, USA","S24,B2B,Engineering, Product and Design"
ideate.xyz,AI design co-pilot for content creators,"San Francisco, CA, USA","S24,B2B,Engineering, Product and Design"
Kisho,The AI Data Scientist - a Jupyter Notebook that writes itself.,"San Francisco, CA, USA","S24,B2B,Engineering, Product and Design"
FirstWork,Rippling for frontline workers,"San Francisco, CA, USA","S24,B2B,Human Resources"
Sorcerer,We build weather balloons that collect 1000x more data,"San Francisco, CA, USA","S24,Industrials,Climate"
Wordware,IDE for Building AI Agents with Natural Language Programming,"San Francisco, CA, USA","S24,B2B,Infrastructure"
Honeycomb,Building agents that can code.,"San Francisco, CA, USA","S24,B2B,Engineering, Product and Design"
Maitai,Production-ready AI without the heavy lift,"San Francisco, CA, USA","S24,B2B,Engineering, Product and Design"
Corgi,Corgi is building an AI insurance company,"San Francisco, CA, USA","S24,Fintech,Insurance"
Phonely,Go from a website to an AI receptionist in just a few minutes,"San Francisco, CA, USA","S24,B2B"
VideoGen,Generate professional videos in seconds,"San Francisco, CA, USA","S24,B2B"
Clara,"Helping families discover, hire, and manage in-home caregivers","New York, NY, USA","S24,Healthcare,Consumer Health and Wellness"
Stack Auth,Open-source auth & user management for developers,,"S24,B2B,Engineering, Product and Design"
Patchwork Technologies,Building the next generation logging and observability platform,"London, England, United Kingdom","S24,B2B,Engineering, Product and Design"
Tabular,AI Copilot for Accounting Firms,"Berlin, Berlin, Germany","S24,B2B,Finance and Accounting"
Callback,AI-native business process outsourcing,"San Francisco, CA, USA","S24,B2B,Operations"
Flyflow,The easiest way to find high-quality sales leads,"San Francisco, CA, USA","S24,B2B,Sales"
Bayesline,Highly customizable and blazingly fast analytics for asset managers.,"New York, NY, USA","S24,Fintech,Asset Management"
DigitalCarbon,Transform Images And Videos Into Immersive 3D With AI,"San Francisco, CA, USA","S24,B2B"
Random Labs,Random labs is building fully open source software agents,,"S24,B2B,Engineering, Product and Design"
Unsloth AI,Open Source Fine-tuning & Training of LLMs,"San Francisco, CA, USA","S24,B2B,Engineering, Product and Design"
Codes Health,Perfect medical histories prior to care,"New York, NY, USA","S24,Healthcare"
Entangl,Detect errors in complex engineering projects using AI,"San Francisco, CA, USA","S24,B2B,Engineering, Product and Design"
ClaimSorted,Third Party Administrator handling insurance claims with AI,"New York, NY, USA","S24,Fintech,Insurance"
mdhub,Clinical AI assistant for mental health clinicians,"San Francisco, CA, USA","S24,Healthcare"
Hamming AI,Automated testing for AI voice agents,"San Francisco, CA, USA","S24,B2B,Engineering, Product and Design"
Genie,Conversational AI Sidekick for Kids.,"Lake Oswego, OR, USA","S24,Consumer,Social"
ProhostAI,AI-powered operating system for Airbnb hosts,"San Francisco, CA, USA","S24,B2B"
Educato AI,Building exam-prep platforms worldwide using AI,"San Francisco, CA, USA","S24,Education"
Spaceium Inc,Fully automated space stations for refueling and repair of spacecraft,"Long Beach, CA, USA","S24,Industrials,Aviation and Space"
Comfy Deploy,Best place for product teams to use ComfyUI.,"San Francisco, CA, USA","S24,B2B,Engineering, Product and Design"
Synnax,Control & Sensor Data Processing for High-Cadence Hardware Teams,"San Francisco, CA, USA","S24,B2B,Infrastructure"
Theseus,GPS Denied Navigation for Drones,,"S24,Industrials,Drones"
Saphira AI,Vanta for Hardware,"San Francisco, CA, USA","S24,B2B,Engineering, Product and Design"
Glasskube,The next generation Package Manager for Kubernetes,"Vienna, Vienna, Austria","S24,B2B,Infrastructure"
Mem0,The Memory Layer for Personalized AI,"Mountain View, CA, USA","S24,B2B,Infrastructure"
Cheers,The super-app for in-person employee management,"San Francisco, CA, USA","S24,B2B"
Moment Robotics,Robots to automate the movement of goods within hospitals ,Remote,"S24,Industrials,Manufacturing and Robotics"
Ply Health,Faster way to get providers in-network with payers.,Remote,"S24,Healthcare"
Superfilter,Expert assistant that manages your email.,Remote,"S24,Consumer"
Superunit,AI accounting agent for companies selling physical goods,"Los Angeles, CA, USA","S24,B2B,Operations"
Undermind,A search engine for complex questions,"San Francisco, CA, USA","S24,Education"
Domu Technology Inc.,Automating debt collection calls for banks.,"San Francisco, CA, USA","S24,B2B,Engineering, Product and Design"
Apten,Customizable AI SMS agents for businesses,"San Francisco, CA, USA","S24,B2B,Marketing"
Spherecast,AI-powered Inventory Management for Ecommerce,,"S24,B2B,Supply Chain and Logistics"
Miru,Deployment infrastructure for robotics & IoT,"San Francisco, CA, USA","S24,B2B,Infrastructure"
CardLift,We help credit card issuers increase their share of wallet.,"Mountain View, CA, USA","S24,Fintech"
Abel Police,Automating police paperwork,"San Francisco, CA, USA","S24,Government"
Ultra,Robots to package billions of e-commerce orders in warehouses,"New York, NY, USA","S24,Industrials,Manufacturing and Robotics"
Alacrity,AI Based Account Takeover Prevention Platform,"San Francisco, CA, USA","W24,B2B"
Ångström AI,Fast Gen AI molecular simulations that reproduce wetlab results,"San Francisco, CA, USA","S24,Healthcare,Drug Discovery and Delivery"
ParcelBio,Next-generation mRNA medicines,"San Francisco, CA, USA","W24,Healthcare,Therapeutics"
Coval,Simulation & Evaluation for AI Agents,"San Francisco, CA, USA","S24,B2B,Engineering, Product and Design"
K-Scale Labs,Open-source humanoid robots,"Palo Alto, CA, USA","W24,Consumer,Consumer Electronics"
Marr Labs,AI-voice agents that are indistinguishable from humans.,"San Francisco, CA, USA","W24,B2B"
Forge Rewards,Starbucks memberships for restaurants,"San Francisco, CA, USA","W24,B2B"
FanCave,Powering the free agency of college sports,"Roeland Park, KS, USA","W24,Consumer"
RetailReady,An AI-powered supply chain compliance engine,,"W24,B2B,Supply Chain and Logistics"
Million,"Make websites fast, automatically","San Francisco, CA, USA","W24,B2B"
NowHouse,NowHouse is building a new Broadridge.,,"W24,Fintech"
Crux,Embedded AI Copilots on Structured Data,,"W24,B2B,Analytics"
Reprompt,AI Data Agents for reading complex documents and websites,"San Francisco, CA, USA","W24,B2B,Engineering, Product and Design"
InspectMind AI,"Write Construction Inspections Reports using AI, up to 10x faster","San Francisco, CA, USA","W24,Real Estate and Construction,Construction"
Yarn,Make sales and marketing videos with AI.,"San Francisco, CA, USA","W24,B2B"
Blacksmith,Serverless cloud infra for CI,,"W24,B2B,Infrastructure"
CrowdVolt,Bid/ask style ticket exchange powered by automated order fulfillment,"NY, USA","W24,Consumer"
kater.ai,Deliver complete data analysis from a single question,"San Francisco, CA, USA","W24,B2B,Analytics"
MathGPTPro,Ultimate AI Math Problem Solver to Revolutionize Personalized Learning,"Santa Clara, CA, USA","W24,Education"
Tower,Copilot for in-house legal teams.,"San Francisco, CA, USA","W24,B2B,Legal"
Quivr,Open Source Chat-Powered Second Brain,,"W24,B2B,Productivity"
Dragoneye,Helping devs build computer vision models automatically,"New York, NY, USA","W24,B2B,Engineering, Product and Design"
renderlet,Build interactive applications that run anywhere,"New York, NY, USA","W24,B2B,Engineering, Product and Design"
Fume,We are building the AI Software Developer,"San Francisco, CA, USA","W24,B2B,Engineering, Product and Design"
Numo,The offshore bank for international contractors,"San Francisco, CA, USA","W24,Fintech,Banking and Exchange"
Forge,Procurement software for hardware companies,,"W24,B2B"
Taiki,Universal API for tax data,,"W24,B2B,Engineering, Product and Design"
Konstructly,The Modern Operating System for Construction,"London, England, United Kingdom","W24,B2B"
Pico,Pico organizes and takes action on your iPhone screenshots,,"W24,Consumer"
Granza Bio,Cancer targeting attack particles,"San Francisco, CA, USA","W24,Healthcare,Therapeutics"
Haplotype Labs,Personalized prevention using genetics and AI,Remote,"W24,Healthcare,Diagnostics"
Healia,Modern health insurance for dual income families,,"W24,Fintech,Insurance"
TrueClaim,"Transparent, AI-powered healthcare TPA.","San Francisco, CA, USA","W24,Healthcare"
CoCrafter,B2B construction marketplace to match contractors and subcontractors.,"Munich, BY, Germany","W24,Real Estate and Construction,Construction"
Reform,Retool for logistics companies,"San Francisco, CA, USA","W24,B2B,Supply Chain and Logistics"
Piramidal,Foundation Model for the Brain,"San Francisco, CA, USA","W24,Healthcare"
Junction Bioscience,AI Hypothesis Engine for Molecular Discovery,"San Francisco, CA, USA","W24,Healthcare,Therapeutics"
Evolvere BioSciences,Making Next-Generation Antibiotics that Outsmart Bacterial Evolution,"Oxford, England, United Kingdom","S24,Healthcare,Therapeutics"
Spur,Spur is your AI QA Engineer. Test your websites with natural language.,"San Francisco, CA, USA","S24,B2B,Engineering, Product and Design"
OddsView,The Bloomberg Terminal of Sports Betting,"New York, NY, USA","W24,Consumer"
Silogy,An AI-powered test and debug platform for chip developers,"New York, NY, USA","W24,B2B,Engineering, Product and Design"
Senso,AI-Powered Knowledge Base for Customer Support,"Toronto, ON, Canada","W24,B2B,Analytics"
Eris Biotech,Our drugs engage the immune system to fight tumors,"American Fork, UT, USA","W24,Healthcare,Therapeutics"
Powder,AI Agents for precise document analysis,,"W24,Fintech,Asset Management"
OpenFoundry,The fastest developer experience for building on open source AI.,"San Francisco, CA, USA","W24,B2B,Engineering, Product and Design"
GoldenBasis,Modern back-office software for brokerages,"San Francisco, CA, USA","W24,Fintech,Banking and Exchange"
Penciled,Generative AI voice agents for healthcare,,"W24,Healthcare,Healthcare IT"
Magic Hour,Platform for AI video generation.,"San Francisco, CA, USA","W24,Consumer,Content"
Ryse,The secondary market for real estate leases,"New York, NY, USA","W24,B2B"
Lumona,AI-enabled search engine featuring perspectives from social media.,"San Francisco, CA, USA","W24,Consumer"
Datacurve,Curated data for training LLMs,,"W24,B2B"
Marblism,Generate a fully-functional web app from a single prompt,,"W24,B2B,Engineering, Product and Design"
CommodityAI,AI-Powered Shipment Management for Commodity Traders,"San Francisco, CA, USA","W24,B2B,Supply Chain and Logistics"
Veles,Copilot for Enterprise Software Sales,"Santa Barbara, CA, USA","W24,B2B,Sales"
Miden,Miden is a card issuer processor and core banking for businesses in…,"Ikeja, LA, Nigeria","W24,Fintech"
Fluently,AI-powered speaking coach for calls,Remote,"W24,B2B,Productivity"
Basepilot,"AI coworkers to automate browser work, in minutes.","San Francisco, CA, USA","W24,B2B,Productivity"
Aqua Voice,Voice-only text editor,"San Francisco, CA, USA","W24,Consumer"
Fileforge,API For PDF Document Workflows,"San Francisco, CA, USA","W24,B2B,Engineering, Product and Design"
xPay,"International Billing Ops, Sales Tax and Payments for SaaS businesses","San Francisco, CA, USA","W24,Fintech,Payments"
DeepNight,Building The Next Generation of Night Vision Devices,"San Francisco, CA, USA","W24,Government"
Vista Power,Modular battery energy storage for businesses,"San Francisco, CA, USA","W24,Industrials,Energy"
ForEffect,AI Video Effects,"San Francisco, CA, USA","W24,Consumer,Content"
Ocular AI,The Open Core Enterprise Search and Generative AI Platform,"San Francisco, CA, USA","W24,B2B"
Retell AI,Supercharge Your Contact Center Operations with AI Phone Agents,,"W24,B2B,Infrastructure"
Rove,The first travel credit card for Generation Z.,"New York, NY, USA","W24,Fintech,Credit and Lending"
camelAI,Connect your tools to AI. Talk to your tools and take action.,"Austin, TX, USA","W24,B2B,Engineering, Product and Design"
Spark,AI-powered workflows for large-scale clean energy,,"W24,B2B"
Titan,Open-source toolkit for data compliance,"San Francisco, CA, USA","W24,B2B,Infrastructure"
Terrakotta,AI platform for phone-first sellers,"San Francisco, CA, USA","W24,B2B,Sales"
Stacksync,Real-time and two-way sync between CRMs and Databases,,"W24,B2B,Engineering, Product and Design"
Hatchet,Background task orchestration and visibility,"New York, NY, USA","W24,B2B,Infrastructure"
Shepherd,Every student's personalized learning assistant,Remote,"W24,Education"
Sonauto,Create hit songs with AI,"San Francisco, CA, USA","W24,Consumer,Content"
BiteSight,The video-first food delivery app. Imagine TikTok meets DoorDash.,,"W24,Consumer,Social"
Velorum Therapeutics,Powerful cancer drugs that starve tumors,"San Francisco, CA, USA","W24,Healthcare,Therapeutics"
Zep AI,The Memory Foundation For Your AI Stack,"San Francisco, CA, USA","W24,B2B"
Openmart,AI alternative to ZoomInfo,,"W24,B2B"
Triply,Operating system for travel businesses in Africa with embedded finance,"Nairobi, Nairobi County, Kenya","W24,B2B,Operations"
Amber AI,Super app for kids ,,"W24,Education"
Thorntale,Easiest way for post-sales teams to create data-driven presentations,"San Francisco, CA, USA","W24,B2B,Analytics"
Alai,Create high quality presentations faster using AI,,"W24,B2B"
PocketPod,AI generated podcasts tailored to your interests,"San Francisco, CA, USA","W24,Consumer"
Sample,Automating reimbursement for healthcare providers.,"San Francisco, CA, USA","W24,Healthcare,Healthcare IT"
Brainbase,AI workflow automations for enterprise,"San Francisco, CA, USA","W24,B2B"
Focal,AI video creation tool for TV shows and movies,"San Francisco, CA, USA","W24,Consumer,Content"
Givefront,Banking for Nonprofits,,"W24,Fintech,Banking and Exchange"
Cleva,USD banking platform for Africa,"Lagos, LA, Nigeria","W24,Fintech"
Oma Care,Get paid for taking care of your parents. ,"San Francisco, CA, USA","W24,Healthcare,Healthcare Services"
Ligo Biosciences,Generative enzyme design for the chemical industry.,"San Francisco, CA, USA","S24,Healthcare,Industrial Bio"
Artos,"Turning science into regulatory submissions in minutes, not months.",,"W24,B2B"
Model ML,AI tool for private equity firms and investment banks.,"London, England, United Kingdom","W24,B2B,Finance and Accounting"
BetterBasket,Pricing for grocers with competitive data,"San Francisco, CA, USA","W24,B2B,Analytics"
Circleback,AI-powered meeting productivity suite,,"W24,B2B,Productivity"
just words,Scale hyper-personalized messaging with AI,,"W24,B2B,Marketing"
ACX,Therapeutics inspired by bacteria's natural killing abilities,"San Francisco, CA, USA","S24,Healthcare,Industrial Bio"
Risotto,Risotto auto-solves IT support requests using AI,"San Francisco, CA, USA","W24,B2B,Operations"
DianaHR,An AI-Powered HR Person ,"San Francisco, CA, USA","W24,B2B,Human Resources"
HeartByte,GenAI Webtoon. Creator write fictions 10x faster.,"San Francisco, CA, USA","W24,Consumer,Content"
Yondu,Grocery Store Automation with Intelligent Robotics,"San Francisco, CA, USA","W24,B2B,Retail"
dawn,Analytics for AI products.,,"W24,B2B,Engineering, Product and Design"
Lumina,AI Search Engine for Research,"San Francisco, CA, USA","W24,Consumer"
Centauri AI,The Modern ETL and Data Science Platform for Finance,"Alameda, CA, USA","W24,Fintech,Asset Management"
ProSights,AI-Native Operating System for the Modern Investment Firm,"New York, NY, USA","W24,B2B,Productivity"
Manifold Freight,Aggregating Spot Freight Opportunities for Carriers,"Seattle, WA, USA","W24,B2B,Supply Chain and Logistics"
edgetrace,Real-world video understanding models,,"W24,B2B"
Clarum,AI-powered investment due diligence,"San Francisco, CA, USA","W24,B2B,Finance and Accounting"
Opencall.ai,AI call centers for any business,,"W24,B2B"
Voicepanel,Better surveys with AI,,"W24,B2B,Analytics"
Petra Security,Cybersecurity,"San Francisco, CA, USA","W24,Consumer,Social"
Abel,Transforming document review for litigation teams,"San Francisco, CA, USA","W24,B2B,Legal"
OffDeal,AI-native investment bank for buying SMBs,"New York, NY, USA","W24,B2B"
Delve,"HIPAA and SOC 2 in days, not months.","San Francisco, CA, USA","W24,B2B,Security"
Overeasy,Go from idea to CV model 100x faster,"San Francisco, CA, USA","S24,B2B"
Andy AI,Faster clinical documentation for home health nurses,"San Francisco, CA, USA","W24,Healthcare,Healthcare IT"
Hazel,AI-enabled procurement software for government,,"W24,Government"
Shiboleth,Shiboleth automates lending compliance for financial institutions…,"New York, NY, USA","W24,B2B,Security"
Aftercare,Conversational post-purchase surveys using AI,"San Francisco, CA, USA","W24,B2B,Marketing"
Soundry AI,Professional Quality AI Music Creation,"Seattle, WA, USA","W24,Consumer,Content"
Elodin,The future of aerospace software.,"San Francisco, CA, USA","W24,Industrials,Aviation and Space"
HostAI,The operating system for managing vacation rentals. ,"San Francisco, CA, USA","W24,B2B"
Trieve,Infrastructure for search teams building retrieval and RAG,"San Francisco, CA, USA","W24,B2B,Infrastructure"
Tensorfuse,Run serverless GPUs on your own cloud,,"W24,B2B,Engineering, Product and Design"
Toma,AI for auto dealerships,,"W24,B2B,Operations"
Carma,Same-Day Auto Repair for Commercial Fleets.,"San Francisco, CA, USA","W24,B2B,Marketing"
Preloop,Translate your experimental scripts into production ML services,,"W24,B2B,Engineering, Product and Design"
Superagent,ChatGPT for Compliance,"San Francisco, CA, USA","W24,B2B"
Bilanc,The Unit Economics Platform,"London, England, United Kingdom","W24,B2B,Finance and Accounting"
AdRizz.com,AI Generator for Ad Creatives,"San Francisco, CA, USA","W24,B2B,Engineering, Product and Design"
Browser Buddy,Recommendations across the web,"San Francisco, CA, USA","W24,Consumer,Content"
Astro Mechanica,New jet engines for the new Jet Age.,"San Francisco, CA, USA","W24,Industrials,Aviation and Space"
CodeAnt AI,AI Code Reviewer,"San Francisco, CA, USA","W24,B2B,Engineering, Product and Design"
Draftaid,Go from 3D models to CAD drawings using AI,"Toronto, ON, Canada","W24,B2B,Engineering, Product and Design"
Metofico,No Code Data Analysis for Life Science Research,"London, England, United Kingdom","W24,B2B,Engineering, Product and Design"
Ellipsis,AI code reviews & bug fixes,,"W24,B2B,Engineering, Product and Design"
Dime,The Factory Operating System,,"W24,B2B"
Lytix,Analytics and alerts that make sense. ,"New York, NY, USA","W24,B2B,Engineering, Product and Design"
Pythagora (GPT Pilot),OSS dev tool that builds entire apps from scratch by talking to you,,"W24,B2B,Engineering, Product and Design"
Wuri,"App to read fiction stories as visual novels with images, videos,…",,"W24,Consumer,Content"
Open,Autopilot customer support that saves you $100K a year,"San Francisco, CA, USA","W24,B2B,Engineering, Product and Design"
Aedilic,Aedilic is building gpudeploy.com,"Palo Alto, CA, USA","W24,B2B"
Salvy,Mobile carrier for businesses in Brazil,"Curitiba, PR, Brazil","W24,B2B,Operations"
Centralize,The AI-powered relationship intelligence platform for enterprise sales,"San Francisco, CA, USA","W24,B2B,Sales"
phospho,Open Source Text Analytics for LLM Apps,"San Francisco, CA, USA","W24,B2B,Analytics"
Quantic,Next generation data for Sales teams.,"San Francisco, CA, USA","W24,B2B,Sales"
Resonance,Optimize NRR within your product,"San Francisco, CA, USA","W24,B2B,Marketing"
Firebender,Android Studio Coding Assistant,"San Francisco, CA, USA","W24,B2B,Sales"
Aether Energy,AI design and workflow software for solar installers worldwide,"San Francisco, CA, USA","W24,B2B,Engineering, Product and Design"
Fuse,AI contract analytics to maximize revenue for healthcare providers,"London, England, United Kingdom","S24,Healthcare"
Kiosk,WhatsApp Marketing for E-commerce,"Paris, Île-de-France, France","W24,B2B,Marketing"
Ragas,Building the open source standard for evaluating LLM Applications,"San Francisco, CA, USA","W24,B2B,Infrastructure"
sync labs,AI lipsync tool for video content creators,,"W24,B2B"
PandasAI,PandasAI is an open-source conversational data analysis platform with…,"Munich, BY, Germany","W24,B2B,Analytics"
Infinity,Business banking for cross-border SMBs & Startups,"Bengaluru, KA, India","W24,Fintech,Payments"
InQuery,AI-Native Operating System for the Insurance Industry,,"W24,Fintech,Insurance"
Markprompt,AI for customer support,"San Francisco, CA, USA","W24,B2B,Infrastructure"
Tamarind Bio,Easy to use computational biology tools for drug discovery,"San Francisco, CA, USA","W24,B2B"
Anaphero,Automating voice-based healthcare workflows,"Austin, TX, USA","W24,Healthcare"
Swift,Instant deposit API for brokerages and digital banks,"San Francisco, CA, USA","W24,Fintech,Payments"
Intercept,Helping CPG brands automatically flag and dispute invalid retail fees,"San Francisco, CA, USA","W24,B2B,Retail"
Creo,Build internal tools with AI,"Bengaluru, KA, India","W24,B2B,Engineering, Product and Design"
Decipher AI,Helping engineers understand and fix production bugs,"San Francisco, CA, USA","W24,B2B,Engineering, Product and Design"
Infinity AI,"Type a script, get a movie. ","San Francisco, CA, USA","W24,Consumer,Content"
Double,Design Your Own Stock Index,"San Francisco, CA, USA","W24,Fintech,Asset Management"
Speck,AI assistant for web automation,"San Francisco, CA, USA","W24,B2B,Productivity"
Guide Labs,Interpretable foundation models that are easy to steer and understand,"San Francisco, CA, USA","W24,B2B"
Central,"Automating BS work for founders - payroll, benefits, govt. filings etc","San Francisco, CA, USA","S24,B2B,Human Resources"
